Symbol,Name,Country,Sector,Industry
IDXX,IDEXX Laboratories Inc. Common Stock,United States,Health Care,Biotechnology: In Vitro & In Vivo Diagnostic Substances
IDYA,IDEAYA Biosciences Inc. Common Stock,United States,Health Care,Biotechnology: Pharmaceutical Preparations
IEP,Icahn Enterprises L.P. Common Stock,United States,Industrials,Consumer Electronics/Appliances
IESC,IES Holdings Inc. Common Stock,United States,Industrials,Engineering & Construction
IFBD,Infobird Co. Ltd Ordinary Shares,China,Technology,Computer Software: Prepackaged Software
IFRX,InflaRx N.V. Common Stock,Germany,Health Care,Biotechnology: Pharmaceutical Preparations
IGAC,IG Acquisition Corp. Class A Common Stock,United States,Industrials,Consumer Electronics/Appliances
IGACU,IG Acquisition Corp. Unit,United States,Industrials,Consumer Electronics/Appliances
IGACW,IG Acquisition Corp. Warrant,United States,Industrials,Consumer Electronics/Appliances
IGIC,International General Insurance Holdings Ltd. Ordinary Share,Jordan,Finance,Property-Casualty Insurers
IGMS,IGM Biosciences Inc. Common Stock,United States,Health Care,Biotechnology: Pharmaceutical Preparations
IHRT,iHeartMedia Inc. Class A Common Stock,United States,Consumer Discretionary,Broadcasting
III,Information Services Group Inc. Information Services Group Inc. Common Stock,United States,Technology,EDP Services
IIIV,i3 Verticals Inc. Class A Common Stock,United States,Technology,EDP Services
IINN,Inspira Technologies Oxy B.H.N. Ltd. Ordinary Shares,Israel,Health Care,Medical/Dental Instruments
IINNW,Inspira Technologies Oxy B.H.N. Ltd. Warrant,Israel,Health Care,Medical/Dental Instruments
IIVIP,Coherent Corp. 6.00% Series A Mandatory Convertible Preferred Stock,United States,Industrials,Industrial Machinery/Components
IKNA,Ikena Oncology Inc. Common Stock,United States,Health Care,Biotechnology: Pharmaceutical Preparations
IKT,Inhibikase Therapeutics Inc. Common Stock,United States,Health Care,Biotechnology: Pharmaceutical Preparations
ILAG,Intelligent Living Application Group Inc. Ordinary Shares,Hong Kong,Consumer Discretionary,Office Equipment/Supplies/Services
ILMN,Illumina Inc. Common Stock,United States,Health Care,Medical Specialities
ILPT,Industrial Logistics Properties Trust Common Shares of Beneficial Interest,United States,Real Estate,Real Estate Investment Trusts
IMAB,I-MAB American Depositary Shares,China,Health Care,Biotechnology: Pharmaceutical Preparations
IMACW,IMAC Holdings Inc. Warrant,United States,Health Care,Medical Specialities
IMAQ,International Media Acquisition Corp. Class A Common Stock,United States,Industrials,Consumer Electronics/Appliances
IMAQR,International Media Acquisition Corp. Rights,United States,Finance,Business Services
IMAQU,International Media Acquisition Corp. Unit,United States,Industrials,Consumer Electronics/Appliances
IMAQW,International Media Acquisition Corp. Warrants,United States,Industrials,Consumer Electronics/Appliances
IMBI,iMedia Brands Inc. Class A Common Stock,United States,Consumer Discretionary,Catalog/Specialty Distribution
IMBIL,iMedia Brands Inc. 8.5% Senior Notes Due 2026,United States,Consumer Discretionary,Catalog/Specialty Distribution
IMCC,IM Cannabis Corp. Common Shares,Canada,Health Care,Pharmaceuticals and Biotechnology
IMCI,Infinite Group Inc.,United States,,
IMCR,Immunocore Holdings plc American Depositary Shares,United Kingdom,Health Care,Biotechnology: Biological Products (No Diagnostic Substances)
IMGN,ImmunoGen Inc. Common Stock,United States,Health Care,Biotechnology: Pharmaceutical Preparations
IMGO,Imago BioSciences Inc. Common stock,United States,Health Care,Biotechnology: Pharmaceutical Preparations
IMKTA,Ingles Markets Incorporated Class A Common Stock,United States,Consumer Staples,Food Chains
IMMP,Immutep Limited American Depositary Shares,Australia,Health Care,Biotechnology: Pharmaceutical Preparations
IMMR,Immersion Corporation Common Stock,United States,Technology,Computer peripheral equipment
IMMX,Immix Biopharma Inc. Common Stock,United States,Health Care, Medicinal Chemicals and Botanical Products 
IMNM,Immunome Inc. Common Stock,United States,Health Care, Medicinal Chemicals and Botanical Products 
IMNN,Imunon Inc. Common Stock,United States,Health Care,Biotechnology: Pharmaceutical Preparations
IMOS,ChipMOS TECHNOLOGIES INC. American Depositary Shares,Taiwan,Technology,Semiconductors
IMPL,Impel Pharmaceuticals Inc. Common Stock,United States,Health Care,Biotechnology: Pharmaceutical Preparations
IMPP,Imperial Petroleum Inc. Common Shares,Greece,Consumer Discretionary,Marine Transportation
IMPPP,Imperial Petroleum Inc. 8.75% Series A Cumulative Redeemable Perpetual Preferred Shares,Greece,Consumer Discretionary,Marine Transportation
IMRA,IMARA Inc. Common Stock,United States,Health Care,Biotechnology: Biological Products (No Diagnostic Substances)
IMRN,Immuron Limited American Depositary Shares,Australia,Health Care,Biotechnology: Pharmaceutical Preparations
IMRX,Immuneering Corporation Class A Common Stock,United States,Health Care,Biotechnology: Pharmaceutical Preparations
IMTE,Integrated Media Technology Limited Ordinary Shares,Australia,Consumer Staples,Consumer Electronics/Appliances
IMTX,Immatics N.V. Ordinary Shares,Germany,Health Care,Biotechnology: Biological Products (No Diagnostic Substances)
IMTXW,Immatics N.V. Warrants,Germany,Health Care,Biotechnology: Biological Products (No Diagnostic Substances)
IMUX,Immunic Inc. Common Stock,United States,Health Care,Biotechnology: Pharmaceutical Preparations
IMV,IMV Inc. Common Shares,Canada,Health Care,Pharmaceuticals and Biotechnology
IMVT,Immunovant Inc. Common Stock,United States,Health Care,Biotechnology: Pharmaceutical Preparations
IMXI,International Money Express Inc. Common Stock,United States,Technology,Retail: Computer Software & Peripheral Equipment
INAB,IN8bio Inc. Common Stock,United States,Health Care,Biotechnology: Pharmaceutical Preparations
INBK,First Internet Bancorp Common Stock,United States,Finance,Major Banks
INBKZ,First Internet Bancorp 6.0% Fixed-to-Floating Rate Subordinated Notes Due 2029,United States,Finance,Major Banks
INBS,Intelligent Bio Solutions Inc. Common Stock,United States,Health Care,Medical Specialities
INBX,Inhibrx Inc. Common Stock,United States,Health Care,Biotechnology: Pharmaceutical Preparations
INCR,Intercure Ltd. Ordinary Shares,Israel,Health Care,Biotechnology: Pharmaceutical Preparations
INCY,Incyte Corp. Common Stock,United States,Health Care,Biotechnology: Commercial Physical & Biological Resarch
INDB,Independent Bank Corp. Common Stock,United States,Finance,Major Banks
INDI,indie Semiconductor Inc. Class A Common Stock,United States,Technology,Semiconductors
INDIW,indie Semiconductor Inc. Warrant,United States,Technology,Semiconductors
INDP,Indaptus Therapeutics Inc. Common Stock,United States,Health Care,Biotechnology: Pharmaceutical Preparations
INDT,INDUS Realty Trust Inc. (MD) Common Stock,United States,Real Estate,Real Estate Investment Trusts
INFI,Infinity Pharmaceuticals Inc. Common Stock,United States,Health Care,Biotechnology: Pharmaceutical Preparations
INFN,Infinera Corporation Common Stock,United States,Utilities,Telecommunications Equipment
INGN,Inogen Inc Common Stock,United States,Health Care,Industrial Specialties
INKA,KludeIn I Acquisition Corp. Class A Common Stock,United States,Technology,EDP Services
INKAW,KludeIn I Acquisition Corp. Warrant,United States,Industrials,Consumer Electronics/Appliances
INKT,MiNK Therapeutics Inc. Common Stock,United States,Health Care, Medicinal Chemicals and Botanical Products 
INM,InMed Pharmaceuticals Inc. Common Shares,Canada,Health Care,Pharmaceuticals and Biotechnology
INMB,INmune Bio Inc. Common stock,United States,Health Care,Biotechnology: Pharmaceutical Preparations
INMD,InMode Ltd. Ordinary Shares,Israel,Health Care,Medical/Nursing Services
INNV,InnovAge Holding Corp. Common Stock,United States,Health Care,Hospital/Nursing Management
INO,Inovio Pharmaceuticals Inc. Common Stock,United States,Health Care,Biotechnology: Biological Products (No Diagnostic Substances)
INOD,Innodata Inc. Common Stock,United States,Technology,EDP Services
INPX,Inpixon Common Stock,United States,Technology,Computer Software: Prepackaged Software
INSE,Inspired Entertainment Inc. Common Stock,United States,Technology,EDP Peripherals
INSG,Inseego Corp. Common Stock,United States,Telecommunications,Telecommunications Equipment
INSM,Insmed Incorporated Common Stock,United States,Health Care,Biotechnology: Pharmaceutical Preparations
INTA,Intapp Inc. Common Stock,United States,Technology,Computer Software: Prepackaged Software
INTC,Intel Corporation Common Stock,United States,Technology,Semiconductors
INTE,Integral Acquisition Corporation 1 Class A Common Stock,United States,Industrials,Consumer Electronics/Appliances
INTEU,Integral Acquisition Corporation 1 Unit,United States,Industrials,Consumer Electronics/Appliances
INTEW,Integral Acquisition Corporation 1 Warrants,United States,Industrials,Consumer Electronics/Appliances
INTG,Intergroup Corporation (The) Common Stock,United States,Consumer Discretionary,Hotels/Resorts
INTR,Inter & Co. Inc. Class A Common Shares,Brazil,,
INTU,Intuit Inc. Common Stock,United States,Technology,Computer Software: Prepackaged Software
INTZ,Intrusion Inc. Common Stock,United States,Technology,Security Systems Services
INVA,Innoviva Inc. Common Stock,United States,Health Care,Biotechnology: Pharmaceutical Preparations
INVE,Identiv Inc. Common Stock,United States,Technology,Computer peripheral equipment
INVO,INVO BioScience Inc. Common Stock,United States,Health Care,Medical/Dental Instruments
INVZ,Innoviz Technologies Ltd. Ordinary shares,Israel,Consumer Discretionary,Auto Parts:O.E.M.
INVZW,Innoviz Technologies Ltd. Warrant,Israel,Consumer Discretionary,Auto Parts:O.E.M.
INZY,Inozyme Pharma Inc. Common Stock,United States,Health Care,Biotechnology: Pharmaceutical Preparations
IOAC,Innovative International Acquisition Corp. Class A Ordinary Shares,United States,Finance,Business Services
IOACU,Innovative International Acquisition Corp. Unit,United States,Finance,Business Services
IOACW,Innovative International Acquisition Corp. Warrants,United States,Finance,Business Services
IOBT,IO Biotech Inc. Common Stock,Denmark,Health Care,Biotechnology: Pharmaceutical Preparations
IONM,Assure Holdings Corp. Common Stock,United States,Health Care,Assisted Living Services
IONR,ioneer Ltd American Depositary Shares,Australia,,
IONS,Ionis Pharmaceuticals Inc. Common Stock,United States,Health Care,Biotechnology: Pharmaceutical Preparations
IOSP,Innospec Inc. Common Stock,United States,Industrials,Industrial Specialties
IOVA,Iovance Biotherapeutics Inc. Common Stock,United States,Health Care,Biotechnology: Pharmaceutical Preparations
IPA,ImmunoPrecise Antibodies Ltd. Common Stock,Canada,Health Care,Pharmaceuticals and Biotechnology
IPAR,Inter Parfums Inc. Common Stock,United States,Consumer Discretionary,Package Goods/Cosmetics
IPAX,Inflection Point Acquisition Corp. Class A Ordinary Share,United States,Finance,Business Services
IPAXU,Inflection Point Acquisition Corp. Units,United States,Finance,Business Services
IPAXW,Inflection Point Acquisition Corp. Warrants,United States,Finance,Business Services
IPDN,Professional Diversity Network Inc. Common Stock,United States,Technology,EDP Services
IPGP,IPG Photonics Corporation Common Stock,United States,Technology,Semiconductors
IPHA,Innate Pharma S.A. ADS,France,Health Care,Biotechnology: Pharmaceutical Preparations
IPSC,Century Therapeutics Inc. Common Stock,United States,Health Care, Medicinal Chemicals and Botanical Products 
IPVI,InterPrivate IV InfraTech Partners Inc. Class A Common Stock,United States,Industrials,Consumer Electronics/Appliances
IPVIU,InterPrivate IV InfraTech Partners Inc. Units,United States,Industrials,Consumer Electronics/Appliances
IPVIW,InterPrivate IV InfraTech Partners Inc. Warrant,United States,Industrials,Consumer Electronics/Appliances
IPW,iPower Inc. Common Stock,United States,Consumer Discretionary,Catalog/Specialty Distribution
IPWR,Ideal Power Inc. Common Stock,United States,Industrials,Industrial Machinery/Components
IPX,IperionX Limited American Depositary Share,United States,Consumer Discretionary,Diversified Commercial Services
IQ,iQIYI Inc. American Depositary Shares,China,Technology,Internet and Information Services
IQMD,Intelligent Medicine Acquisition Corp. Class A Common Stock,United States,Industrials,Consumer Electronics/Appliances
IQMDU,Intelligent Medicine Acquisition Corp. Unit,United States,Industrials,Consumer Electronics/Appliances
IQMDW,Intelligent Medicine Acquisition Corp. Warrant,United States,Industrials,Consumer Electronics/Appliances
IRAA,Iris Acquisition Corp Class A Common Stock,United States,Industrials,Consumer Electronics/Appliances
IRAAW,Iris Acquisition Corp Warrant,United States,Industrials,Consumer Electronics/Appliances
IRBT,iRobot Corporation Common Stock,United States,,
IRDM,Iridium Communications Inc Common Stock,United States,Consumer Discretionary,Telecommunications Equipment
IREN,Iris Energy Limited Ordinary Shares,Australia,Technology,EDP Services
IRIX,IRIDEX Corporation Common Stock,United States,Health Care,Biotechnology: Electromedical & Electrotherapeutic Apparatus
IRMD,iRadimed Corporation Common Stock,United States,Health Care,Medical/Dental Instruments
IRON,Disc Medicine Inc. Common Stock,United States,,
IROQ,IF Bancorp Inc. Common Stock,United States,Finance,Finance: Consumer Services
IRTC,iRhythm Technologies Inc. Common Stock,United States,Health Care,Medical/Dental Instruments
IRWD,Ironwood Pharmaceuticals Inc. Class A Common Stock,United States,Health Care,Biotechnology: Pharmaceutical Preparations
ISEE,IVERIC bio Inc. Common Stock,United States,Health Care,Biotechnology: Pharmaceutical Preparations
ISIG,Insignia Systems Inc. Common Stock,United States,Consumer Discretionary,Advertising
ISO,IsoPlexis Corporation Common Stock,United States,Health Care,Biotechnology: Electromedical & Electrotherapeutic Apparatus
ISPC,iSpecimen Inc. Common Stock,United States,Health Care,Precision Instruments
ISPO,Inspirato Incorporated Class A Common Stock,United States,Consumer Discretionary,Hotels/Resorts
ISPOW,Inspirato Incorporated Warrant,United States,Consumer Discretionary,Hotels/Resorts
ISRG,Intuitive Surgical Inc. Common Stock,United States,Health Care,Medical/Dental Instruments
ISSC,Innovative Solutions and Support Inc. Common Stock,United States,Industrials,Military/Government/Technical
ISTR,Investar Holding Corporation Common Stock,United States,Finance,Commercial Banks
ISUN,iSun Inc. Common Stock,United States,Technology,Semiconductors
ITAQ,Industrial Tech Acquisitions II Inc. Class A Common Stock,United States,Industrials,Consumer Electronics/Appliances
ITAQU,Industrial Tech Acquisitions II Inc. Unit,United States,Industrials,Consumer Electronics/Appliances
ITAQW,Industrial Tech Acquisitions II Inc. Warrants,United States,Industrials,Consumer Electronics/Appliances
ITCI,Intra-Cellular Therapies Inc. Common Stock,United States,Health Care,Biotechnology: Pharmaceutical Preparations
ITI,Iteris Inc. Common Stock,United States,Telecommunications,Telecommunications Equipment
ITIC,Investors Title Company Common Stock,United States,Finance,Specialty Insurers
ITOS,iTeos Therapeutics Inc. Common Stock,United States,Health Care, Medicinal Chemicals and Botanical Products 
ITQ,Itiquira Acquisition Corp. Class A Ordinary Shares,United States,Finance,Business Services
ITRI,Itron Inc. Common Stock,United States,Industrials,Electrical Products
ITRM,Iterum Therapeutics plc Ordinary Share,Ireland,Health Care,Biotechnology: Pharmaceutical Preparations
ITRN,Ituran Location and Control Ltd. Ordinary Shares,Israel,Technology,Electronic Components
IVA,Inventiva S.A. American Depository Shares,France,Consumer Discretionary,Other Consumer Services
IVAC,Intevac Inc. Common Stock,United States,Technology,Industrial Machinery/Components
IVCA,Investcorp India Acquisition Corp. Class A Ordinary Share,Cayman Islands,Finance,Business Services
IVCAU,Investcorp India Acquisition Corp. Unit,Cayman Islands,Finance,Business Services
IVCAW,Investcorp India Acquisition Corp. Warrant,Cayman Islands,Finance,Business Services
IVCB,Investcorp Europe Acquisition Corp I Class A Ordinary Shares,Cayman Islands,Finance,Business Services
IVCBU,Investcorp Europe Acquisition Corp I Unit,Cayman Islands,Finance,Business Services
IVCBW,Investcorp Europe Acquisition Corp I Warrant,Cayman Islands,Finance,Business Services
IVCP,Swiftmerge Acquisition Corp. Class A Ordinary Share,United States,Finance,Business Services
IVCPU,Swiftmerge Acquisition Corp. Unit,United States,Finance,Business Services
IVCPW,Swiftmerge Acquisition Corp. Warrants,United States,Finance,Business Services
IVDA,Iveda Solutions Inc. Common Stock,United States,Technology,Security Systems Services
IVDAW,Iveda Solutions Inc. Warrant,United States,Technology,Security Systems Services
IVVD,Invivyd Inc. Common Stock,United States,Health Care,Biotechnology: Pharmaceutical Preparations
IXAQ,IX Acquisition Corp. Class A Ordinary Share,United Kingdom,Finance,Business Services
IXAQU,IX Acquisition Corp. Unit,United Kingdom,Finance,Business Services
IXAQW,IX Acquisition Corp. Warrant,United Kingdom,Finance,Business Services
IXHL,Incannex Healthcare Limited American Depositary Shares,Australia,,
IZEA,IZEA Worldwide Inc. Common Stock,United States,Consumer Discretionary,Advertising
JACK,Jack In The Box Inc. Common Stock,United States,Consumer Discretionary,Restaurants
JAGX,Jaguar Health Inc. Common Stock,United States,Health Care,Biotechnology: Pharmaceutical Preparations
JAKK,JAKKS Pacific Inc. Common Stock,United States,Consumer Discretionary,Recreational Games/Products/Toys
JAMF,Jamf Holding Corp. Common Stock,United States,Technology,Computer Software: Prepackaged Software
JAN,JanOne Inc. Common Stock (NV),United States,Utilities,Environmental Services
JANX,Janux Therapeutics Inc. Common Stock,United States,Health Care,Biotechnology: Pharmaceutical Preparations
JAQC,Jupiter Acquisition Corporation Common stock,United States,Industrials,Consumer Electronics/Appliances
JAZZ,Jazz Pharmaceuticals plc Common Stock (Ireland),Ireland,Health Care,Biotechnology: Pharmaceutical Preparations
JBHT,J.B. Hunt Transport Services Inc. Common Stock,United States,Industrials,Trucking Freight/Courier Services
JBLU,JetBlue Airways Corporation Common Stock,United States,Consumer Discretionary,Air Freight/Delivery Services
JBSS,John B. Sanfilippo & Son Inc. Common Stock,United States,Consumer Staples,Specialty Foods
JCIC,Jack Creek Investment Corp. Class A Ordinary Shares,United States,Finance,Business Services
JCICU,Jack Creek Investment Corp. Units,United States,Finance,Business Services
JCICW,Jack Creek Investment Corp. Warrants,United States,Finance,Business Services
JCSE,JE Cleantech Holdings Limited Ordinary Shares,Singapore,Consumer Discretionary,Miscellaneous manufacturing industries
JCTCF,Jewett-Cameron Trading Company Common Shares,United States,,
JD,JD.com Inc. American Depositary Shares,China,Consumer Discretionary,Catalog/Specialty Distribution
JEWL,Adamas One Corp. Common Stock,United States,Consumer Discretionary,Consumer Specialties
JFBR,Jeffs' Brands Ltd Ordinary Shares,Israel,Miscellaneous,Diversified Commercial Services
JFBRW,Jeffs' Brands Ltd Warrant,Israel,Miscellaneous,Diversified Commercial Services
JFIN,Jiayin Group Inc. American Depositary Shares,China,Finance,Finance: Consumer Services
JFU,9F Inc. American Depositary Shares,China,Finance,Finance: Consumer Services
JG,Aurora Mobile Limited American Depositary Shares,China,Technology,EDP Services
JGGC,Jaguar Global Growth Corporation I Class A Ordinary Shares,United States,Finance,Business Services
JGGCU,Jaguar Global Growth Corporation I Unit,United States,Finance,Business Services
JJSF,J & J Snack Foods Corp. Common Stock,United States,Consumer Staples,Specialty Foods
JKHY,Jack Henry & Associates Inc. Common Stock,United States,Technology,Retail: Computer Software & Peripheral Equipment
JMAC,Maxpro Capital Acquisition Corp. Class A Common Stock,Taiwan,Industrials,Consumer Electronics/Appliances
JMACW,Maxpro Capital Acquisition Corp. Warrants,Taiwan,Industrials,Consumer Electronics/Appliances
JMSB,John Marshall Bancorp Inc. Common Stock,United States,Finance,Major Banks
JNCE,Jounce Therapeutics Inc. Common Stock,United States,Health Care,Biotechnology: Pharmaceutical Preparations
JOAN,JOANN Inc. Common Stock,United States,Consumer Discretionary,Department/Specialty Retail Stores
JOUT,Johnson Outdoors Inc. Class A Common Stock,United States,Consumer Discretionary,Recreational Games/Products/Toys
JRSH,Jerash Holdings (US) Inc. Common Stock,United States,Consumer Discretionary,Industrial Specialties
JRVR,James River Group Holdings Ltd. Common Shares,Bermuda,Finance,Property-Casualty Insurers
JSM,Navient Corporation 6% Senior Notes due December 15 2043,United States,Finance,Finance: Consumer Services
JSPR,Jasper Therapeutics Inc. Common Stock,United States,Health Care,Biotechnology: Pharmaceutical Preparations
JSPRW,Japer Therapeutics Inc. Warrants,United States,Health Care,Biotechnology: Pharmaceutical Preparations
JUGG,Jaws Juggernaut Acquisition Corporation Class A Ordinary Share,United States,,
JUGGU,Jaws Juggernaut Acquisition Corporation Unit,United States,,
JUGGW,Jaws Juggernaut Acquisition Corporation Warrant,United States,,
JUPW,Jupiter Wellness Inc. Common Stock,United States,Health Care,Biotechnology: Pharmaceutical Preparations
JUPWW,Jupiter Wellness Inc. Warrant,United States,Health Care,Biotechnology: Pharmaceutical Preparations
JVA,Coffee Holding Co. Inc. Common Stock,United States,Consumer Staples,Specialty Foods
JWAC,Jupiter Wellness Acquisition Corp. Class A Common Stock,United States,Industrials,Consumer Electronics/Appliances
JWACR,Jupiter Wellness Acquisition Corp. Right,United States,Finance,Business Services
JWEL,Jowell Global Ltd. Ordinary Shares,China,Consumer Discretionary,Other Consumer Services
JXJT,JX Luxventure Limited Common Stock,China,Consumer Staples,Apparel
JYNT,The Joint Corp. Common Stock,United States,,
JZ,Jianzhi Education Technology Group Company Limited American Depositary Shares,China,Real Estate,Other Consumer Services
JZXN,Jiuzi Holdings Inc. Ordinary Shares,China,Consumer Discretionary,Retail-Auto Dealers and Gas Stations
KA,Kineta Inc. Common Stock,United States,Health Care,Biotechnology: Pharmaceutical Preparations
KACL,Kairous Acquisition Corp. Limited Ordinary Shares,Malaysia,Finance,Business Services
KACLR,Kairous Acquisition Corp. Limited Rights,Malaysia,Finance,Business Services
KACLW,Kairous Acquisition Corp. Limited Warrants,Malaysia,Finance,Business Services
KAII,Kismet Acquisition Two Corp. Class A Ordinary Shares,United States,Finance,Business Services
KAIIU,Kismet Acquisition Two Corp. Unit,United States,Finance,Business Services
KAIIW,Kismet Acquisition Two Corp. Warrant,United States,Finance,Business Services
KAIR,Kairos Acquisition Corp. Class A Ordinary Shares,United States,Finance,Business Services
KAIRU,Kairos Acquisition Corp. Unit,United States,Finance,Business Services
KAIRW,Kairos Acquisition Corp. Warrant,United States,Finance,Business Services
KAL,Kalera Public Limited Company Ordinary Shares,Ireland,Consumer Staples,Farming/Seeds/Milling
KALA,Kala Pharmaceuticals Inc. Common Stock,United States,Health Care,Biotechnology: Pharmaceutical Preparations
KALU,Kaiser Aluminum Corporation Common Stock,United States,Industrials,Aluminum
KALV,KalVista Pharmaceuticals Inc. Common Stock,United Kingdom,Health Care,Biotechnology: Pharmaceutical Preparations
KALWW,Kalera Public Limited Company Warrant,Ireland,Consumer Staples,Farming/Seeds/Milling
KARO,Karooooo Ltd. Ordinary Shares,Singapore,Technology,Computer Software: Prepackaged Software
KAVL,Kaival Brands Innovations Group Inc. Common Stock,United States,Health Care, Medicinal Chemicals and Botanical Products 
KBAL,Kimball International Inc. Class B Common Stock,United States,Consumer Discretionary,Industrial Specialties
KBNT,Kubient Inc. Common Stock,United States,Technology,EDP Services
KBNTW,Kubient Inc. Warrant,United States,Technology,EDP Services
KC,Kingsoft Cloud Holdings Limited American Depositary Shares,China,Technology,Computer Software: Prepackaged Software
KDNY,Chinook Therapeutics Inc. Common Stock,United States,Health Care,Biotechnology: Pharmaceutical Preparations
KDP,Keurig Dr Pepper Inc. Common Stock,United States,Consumer Staples,Beverages (Production/Distribution)
KE,Kimball Electronics Inc. Common Stock,United States,Technology,Industrial Machinery/Components
KELYA,Kelly Services Inc. Class A Common Stock,United States,Consumer Discretionary,Diversified Commercial Services
KELYB,Kelly Services Inc. Class B Common Stock,United States,Consumer Discretionary,Diversified Commercial Services
KEQU,Kewaunee Scientific Corporation Common Stock,United States,Industrials,Medical Specialities
KERN,Akerna Corp. Common Stock,United States,Health Care,Managed Health Care
KERNW,Akerna Corp Warrant,United States,Health Care,Managed Health Care
KFFB,Kentucky First Federal Bancorp Common Stock,United States,Finance,Savings Institutions
KFRC,Kforce Inc. Common Stock,United States,Consumer Discretionary,Diversified Commercial Services
KHC,The Kraft Heinz Company Common Stock,United States,Consumer Staples,Farming/Seeds/Milling
KIDS,OrthoPediatrics Corp. Common Stock,United States,Health Care,Medical/Dental Instruments
KINS,Kingstone Companies Inc. Common Stock,United States,Finance,Specialty Insurers
KINZ,KINS Technology Group Inc. Class A Common Stock,United States,Industrials,Consumer Electronics/Appliances
KINZU,KINS Technology Group Inc. Unit,United States,Industrials,Consumer Electronics/Appliances
KINZW,KINS Technology Group Inc. Warrant,United States,Industrials,Consumer Electronics/Appliances
