Symbol,Name,Country,Sector,Industry
SNT,Senstar Technologies Ltd. Ordinary Shares,Israel,Telecommunications,Telecommunications Equipment
SNTG,Sentage Holdings Inc. Ordinary Shares,China,Finance,Finance: Consumer Services
SNTI,Senti Biosciences Inc. Common Stock,United States,Health Care,Biotechnology: Pharmaceutical Preparations
SNY,Sanofi ADS,France,Health Care,Biotechnology: Pharmaceutical Preparations
SOBR,SOBR Safe Inc. Common Stock,United States,Industrials,Industrial Machinery/Components
SOFI,SoFi Technologies Inc. Common Stock  ,United States,Finance,Diversified Financial Services
SOFO,Sonic Foundry Inc. Common Stock,United States,Technology,Computer Software: Prepackaged Software
SOHO,Sotherly Hotels Inc. Common Stock,United States,Real Estate,Real Estate Investment Trusts
SOHOB,Sotherly Hotels Inc. 8.0% Series B Cumulative Redeemable Perpetual Preferred Stock,United States,Real Estate,Real Estate Investment Trusts
SOHON,Sotherly Hotels Inc. 8.25% Series D Cumulative Redeemable Perpetual Preferred Stock,United States,Real Estate,Real Estate Investment Trusts
SOHOO,Sotherly Hotels Inc. 7.875% Series C Cumulative Redeemable Perpetual Preferred Stock,United States,Real Estate,Real Estate Investment Trusts
SOHU,Sohu.com Limited American Depositary Shares,China,Technology,EDP Services
SOLO,Electrameccanica Vehicles Corp. Ltd. Common Stock,Canada,Consumer Discretionary,Auto Parts:O.E.M.
SOLOW,Electrameccanica Vehicles Corp. Ltd. Warrants,Canada,Consumer Discretionary,Auto Parts:O.E.M.
SOND,Sonder Holdings Inc. Class A Common Stock,United States,,
SONDW,Sonder Holdings Inc. Warrants,United States,,
SONM,Sonim Technologies Inc. Common Stock,United States,Telecommunications,Telecommunications Equipment
SONN,Sonnet BioTherapeutics Holdings Inc. Common Stock,United States,Health Care,Biotechnology: Commercial Physical & Biological Resarch
SONO,Sonos Inc. Common Stock,United States,Consumer Discretionary,Consumer Electronics/Video Chains
SOPA,Society Pass Incorporated Common Stock,United States,Technology,EDP Services
SOPH,SOPHiA GENETICS SA Ordinary Shares,Switzerland,Health Care,Biotechnology: Biological Products (No Diagnostic Substances)
SOTK,Sono-Tek Corporation Common Stock,United States,Industrials,Industrial Machinery/Components
SOUN,SoundHound AI Inc Class A Common Stock,United States,Technology,EDP Services
SOUNW,SoundHound AI Inc. Warrant,United States,Technology,EDP Services
SOVO,Sovos Brands Inc. Common Stock,United States,Consumer Discretionary,Specialty Foods
SP,SP Plus Corporation Common Stock,United States,Consumer Discretionary,Other Consumer Services
SPCB,SuperCom Ltd. Ordinary Shares (Israel),Israel,Technology,Semiconductors
SPCM,Sound Point Acquisition Corp I Ltd Class A Ordinary Share,United States,Finance,Business Services
SPCMW,Sound Point Acquisition Corp I Ltd Warrant,United States,Finance,Business Services
SPFI,South Plains Financial Inc. Common Stock,United States,Finance,Major Banks
SPI,SPI Energy Co. Ltd. Ordinary Shares,China,Technology,Semiconductors
SPKB,Silver Spike Acquisition Corp II Class A Ordinary Shares,United States,Finance,Business Services
SPKBU,Silver Spike Acquisition Corp II Units,United States,Finance,Business Services
SPKBW,Silver Spike Acquisition Corp II Warrant,United States,Finance,Business Services
SPLK,Splunk Inc. Common Stock,United States,Technology,Computer Software: Prepackaged Software
SPNE,SeaSpine Holdings Corporation Common Stock,United States,Health Care,Medical Specialities
SPNS,Sapiens International Corporation N.V. Common Shares (Cayman Islands),Curacao,Technology,Computer Software: Prepackaged Software
SPOK,Spok Holdings Inc. Common Stock,United States,Technology,Retail: Computer Software & Peripheral Equipment
SPPI,Spectrum Pharmaceuticals Inc.Common Stock,United States,Health Care,Biotechnology: Pharmaceutical Preparations
SPRB,Spruce Biosciences Inc. Common Stock,United States,Health Care, Medicinal Chemicals and Botanical Products 
SPRC,SciSparc Ltd. Ordinary Shares,Israel,Health Care,Biotechnology: Pharmaceutical Preparations
SPRO,Spero Therapeutics Inc. Common Stock,United States,Health Care,Biotechnology: Pharmaceutical Preparations
SPRY,ARS Pharmaceuticals Inc. Common Stock,United States,Health Care,Biotechnology: Pharmaceutical Preparations
SPSC,SPS Commerce Inc. Common Stock,United States,Technology,EDP Services
SPT,Sprout Social Inc Class A Common Stock,United States,Technology,EDP Services
SPTN,SpartanNash Company Common Stock,United States,Consumer Discretionary,Food Distributors
SPWH,Sportsman's Warehouse Holdings Inc. Common Stock,United States,Consumer Discretionary,Other Specialty Stores
SPWR,SunPower Corporation Common Stock,United States,Technology,Semiconductors
SQFT,Presidio Property Trust Inc. Class A Common Stock,United States,Real Estate,Real Estate Investment Trusts
SQFTP,Presidio Property Trust Inc. 9.375% Series D Cumulative Redeemable Perpetual Preferred Stock $0.01 par value per share,United States,Real Estate,Real Estate Investment Trusts
SQFTW,Presidio Property Trust Inc. Series A Common Stock Purchase Warrants,United States,Real Estate,Real Estate Investment Trusts
SQL,SeqLL Inc. Common stock,United States,Health Care,Medical Specialities
SQLLW,SeqLL Inc. Warrant,United States,Health Care,Medical Specialities
SRAD,Sportradar Group AG Class A Ordinary Shares,Switzerland,Technology,Computer Software: Programming Data Processing
SRAX,SRAX Inc. Class A Common Stock,United States,Consumer Discretionary,Advertising
SRCE,1st Source Corporation Common Stock,United States,Finance,Major Banks
SRCL,Stericycle Inc. Common Stock,United States,Utilities,Environmental Services
SRDX,Surmodics Inc. Common Stock,United States,Health Care,Biotechnology: Electromedical & Electrotherapeutic Apparatus
SRGA,Surgalign Holdings Inc. Common Stock,United States,Health Care,Industrial Specialties
SRNE,Sorrento Therapeutics Inc.  Common Stock,United States,Health Care,Biotechnology: Commercial Physical & Biological Resarch
SRPT,Sarepta Therapeutics Inc. Common Stock (DE),United States,Health Care,Biotechnology: Pharmaceutical Preparations
SRRK,Scholar Rock Holding Corporation Common Stock,United States,Health Care,Biotechnology: Pharmaceutical Preparations
SRTS,Sensus Healthcare Inc. Common Stock,United States,Health Care,Medical/Dental Instruments
SRZN,Surrozen Inc. Common Stock,United States,Health Care, Medicinal Chemicals and Botanical Products 
SSB,SouthState Corporation Common Stock,United States,Finance,Major Banks
SSBI,Summit State Bank Common Stock,United States,Finance,Major Banks
SSBK,Southern States Bancshares Inc. Common Stock,United States,Finance,Commercial Banks
SSIC,Silver Spike Investment Corp. Common Stock,United States,Health Care, Medicinal Chemicals and Botanical Products 
SSKN,Strata Skin Sciences Inc. Common Stock,United States,Health Care,Medical/Dental Instruments
SSNC,SS&C Technologies Holdings Inc. Common Stock,United States,Technology,EDP Services
SSNT,SilverSun Technologies Inc. Common Stock,United States,Technology,Computer Software: Prepackaged Software
SSP,E.W. Scripps Company (The) Class A Common Stock,United States,Industrials,Broadcasting
SSRM,SSR Mining Inc. Common Stock,Canada,,
SSSS,SuRo Capital Corp. Common Stock,United States,Finance,Finance/Investors Services
SSSSL,SuRo Capital Corp. 6.00% Notes due 2026,United States,Finance,Finance Companies
SSTI,ShotSpotter Inc. Common Stock,United States,Technology,Computer Software: Prepackaged Software
SSYS,Stratasys Ltd. Ordinary Shares (Israel),United States,Technology,Computer peripheral equipment
STAA,STAAR Surgical Company Common Stock,United States,Health Care,Ophthalmic Goods
STAB,Statera Biopharma Inc. Common Stock,United States,Health Care,Biotechnology: Pharmaceutical Preparations
STAF,Staffing 360 Solutions Inc. Common Stock (DE),United States,Consumer Discretionary,Diversified Commercial Services
STBA,S&T Bancorp Inc. Common Stock,United States,Finance,Major Banks
STBX,Starbox Group Holdings Ltd. Ordinary Shares,Malaysia,Consumer Discretionary,Advertising
STCN,Steel Connect Inc. Common Stock,United States,Consumer Discretionary,Advertising
STEL,Stellar Bancorp Inc. Common Stock,United States,Finance,Major Banks
STEP,StepStone Group Inc. Class A Common Stock,United States,Finance,Finance/Investors Services
STER,Sterling Check Corp. Common Stock,United States,Technology,Computer Software: Prepackaged Software
STGW,Stagwell Inc. Class A Common Stock,Canada,Consumer Discretionary,Advertising
STIM,Neuronetics Inc. Common Stock,United States,Health Care,Managed Health Care
STIX,Semantix Inc. Class A Ordinary Shares,United States,Technology,EDP Services
STIXW,Semantix Inc. Warrant,United States,Technology,EDP Services
STKH,Steakholder Foods Ltd. American Depositary Shares,Israel,Consumer Staples,Packaged Foods
STKL,SunOpta Inc. Common Stock,Canada,Basic Materials,Precious Metals
STKS,The ONE Group Hospitality Inc. Common Stock,United States,Consumer Discretionary,Restaurants
STLD,Steel Dynamics Inc.,United States,Industrials,Steel/Iron Ore
STNE,StoneCo Ltd. Class A Common Shares,Brazil,Technology,EDP Services
STOK,Stoke Therapeutics Inc. Common Stock,United States,Health Care,Biotechnology: Pharmaceutical Preparations
STRA,Strategic Education Inc. Common Stock,United States,Consumer Discretionary,Service to the Health Industry
STRC,Sarcos Technology and Robotics Corporation Common Stock,United States,Industrials,Wholesale Distributors
STRCW,Sarcos Technology and Robotics Corporation Warrants,United States,Industrials,Wholesale Distributors
STRL,Sterling Infrastructure Inc. Common Stock,United States,Industrials,Oilfield Services/Equipment
STRM,Streamline Health Solutions Inc. Common Stock,United States,Technology,EDP Services
STRO,Sutro Biopharma Inc. Common Stock,United States,Health Care,Biotechnology: Pharmaceutical Preparations
STRR,Star Equity Holdings Inc. Common Stock,United States,Health Care,Biotechnology: In Vitro & In Vivo Diagnostic Substances
STRRP,Star Equity Holdings Inc. Series A Cumulative Perpetual Preferred Stock,United States,Health Care,Biotechnology: In Vitro & In Vivo Diagnostic Substances
STRS,Stratus Properties Inc. Common Stock,United States,Real Estate,Homebuilding
STRT,STRATTEC SECURITY CORPORATION Common Stock,United States,Consumer Discretionary,Auto Parts:O.E.M.
STSA,Satsuma Pharmaceuticals Inc. Common Stock,United States,Health Care,Biotechnology: Pharmaceutical Preparations
STSS,Sharps Technology Inc. Common Stock,United States,Health Care,Medical/Dental Instruments
STSSW,Sharps Technology Inc. Warrant,United States,Finance,Investment Bankers/Brokers/Service
STTK,Shattuck Labs Inc. Common Stock,United States,Health Care,Biotechnology: Pharmaceutical Preparations
STX,Seagate Technology Holdings PLC Ordinary Shares (Ireland),Ireland,Technology,Electronic Components
SUMO,Sumo Logic Inc. Common Stock,United States,Technology,Retail: Computer Software & Peripheral Equipment
SUNW,Sunworks Inc. Common Stock,United States,Technology,Semiconductors
SUPN,Supernus Pharmaceuticals Inc. Common Stock,United States,Health Care,Biotechnology: Pharmaceutical Preparations
SURF,Surface Oncology Inc. Common Stock,United States,Health Care,Biotechnology: Pharmaceutical Preparations
SURG,SurgePays Inc. Common Stock,United States,Technology,Computer Software: Prepackaged Software
SURGW,SurgePays Inc. Warrant,United States,Technology,Computer Software: Prepackaged Software
SVC,Service Properties Trust Common Stock,United States,Real Estate,Real Estate Investment Trusts
SVFA,SVF Investment Corp. Class A Ordinary Shares,United States,Finance,Business Services
SVFAU,SVF Investment Corp. Unit,United States,Finance,Business Services
SVFAW,SVF Investment Corp. Warrant,United States,Finance,Business Services
SVFB,SVF Investment Corp. 2 Class A Ordinary Shares,United States,Finance,Business Services
SVFD,Save Foods Inc. Common Stock,Israel,,
SVII,Spring Valley Acquisition Corp. II Class A Ordinary Shares,United States,Finance,Business Services
SVIIR,Spring Valley Acquisition Corp. II Rights,United States,,
SVIIW,Spring Valley Acquisition Corp. II Warrant,United States,Finance,Business Services
SVNA,7 Acquisition Corporation Class A Ordinary Shares,United States,Finance,Business Services
SVNAU,7 Acquisition Corporation Unit,United States,Finance,Business Services
SVNAW,7 Acquisition Corporation Warrant,United States,Finance,Business Services
SVRA,Savara Inc. Common Stock,United States,Health Care,Biotechnology: Pharmaceutical Preparations
SVRE,SaverOne 2014 Ltd. American Depositary Shares,Israel,,
SVREW,SaverOne 2014 Ltd. Warrant,Israel,,
SVVC,Firsthand Technology Value Fund Inc. Common Stock,United States,Finance,Finance/Investors Services
SWAG,Stran & Company Inc. Common Stock,United States,Consumer Discretionary,Advertising
SWAGW,Stran & Company Inc. Warrant,United States,Consumer Discretionary,Advertising
SWAV,ShockWave Medical Inc. Common Stock,United States,Health Care,Medical/Dental Instruments
SWBI,Smith & Wesson Brands Inc. Common Stock,United States,Consumer Discretionary,Ordnance And Accessories
SWIM,Latham Group Inc. Common Stock,United States,Industrials,Engineering & Construction
SWIR,Sierra Wireless Inc. Common Stock,Canada,Technology,Radio And Television Broadcasting And Communications Equipment
SWKH,SWK Holdings Corporation Common Stock,United States,Finance,Finance/Investors Services
SWKS,Skyworks Solutions Inc. Common Stock,United States,Technology,Semiconductors
SWSS,Springwater Special Situations Corp. Common stock,United States,Industrials,Consumer Electronics/Appliances
SWSSU,Springwater Special Situations Corp. Unit,United States,Industrials,Consumer Electronics/Appliances
SWSSW,Springwater Special Situations Corp. Warrant,United States,Industrials,Consumer Electronics/Appliances
SWTX,SpringWorks Therapeutics Inc. Common Stock,United States,Health Care,Biotechnology: Pharmaceutical Preparations
SWVL,Swvl Holdings Corp Class A Common Shares,United Arab Emirates,Consumer Discretionary,Business Services
SWVLW,Swvl Holdings Corp Warrant,United Arab Emirates,Consumer Discretionary,Business Services
SXTC,China SXT Pharmaceuticals Inc. Ordinary Shares,China,Health Care,Biotechnology: Pharmaceutical Preparations
SY,So-Young International Inc. American Depository Shares,China,Technology,Computer Software: Prepackaged Software
SYBT,Stock Yards Bancorp Inc. Common Stock,United States,Finance,Major Banks
SYBX,Synlogic Inc. Common Stock,United States,Health Care,Biotechnology: Pharmaceutical Preparations
SYM,Symbotic Inc. Class A Common Stock,United States,Industrials,Consumer Electronics/Appliances
SYNA,Synaptics Incorporated Common Stock $0.001 Par Value,United States,Technology,Computer peripheral equipment
SYNH,Syneos Health Inc. Class A Common Stock,United States,Health Care,Biotechnology: Commercial Physical & Biological Resarch
SYPR,Sypris Solutions Inc. Common Stock,United States,Consumer Discretionary,Auto Parts:O.E.M.
SYRS,Syros Pharmaceuticals Inc. Common Stock,United States,Health Care,Biotechnology: Pharmaceutical Preparations
SYTA,Siyata Mobile Inc. Common Shares,Canada,Industrials,Metal Fabrications
SYTAW,Siyata Mobile Inc. Warrant,Canada,Industrials,Metal Fabrications
SZZL,Sizzle Acquisition Corp. Common stock,United States,Industrials,Consumer Electronics/Appliances
SZZLW,Sizzle Acquisition Corp. Warrant,United States,Industrials,Consumer Electronics/Appliances
TA,TravelCenters of America Inc. Common Stock,United States,Energy,Food Chains
TACT,TransAct Technologies Incorporated Common Stock,United States,Technology,Computer peripheral equipment
TAIT,Taitron Components Incorporated Class A Common Stock,United States,Technology,Electronic Components
TALK,Talkspace Inc. Common Stock,United States,Health Care,Managed Health Care
TALKW,Talkspace Inc. Warrant,United States,Health Care,Managed Health Care
TALS,Talaris Therapeutics Inc. Common Stock,United States,Health Care,Biotechnology: Pharmaceutical Preparations
TANH,Tantech Holdings Ltd. Common Shares,China,,
TANNI,TravelCenters of America Inc. 8.25% Senior Notes due 2028,United States,Energy,Food Chains
TANNL,TravelCenters of America Inc. 8.00% Senior Notes due 2029,United States,Energy,Food Chains
TANNZ,TravelCenters of America Inc. 8.00% Senior Notes due 2030,United States,Energy,Food Chains
TAOP,Taoping Inc. Ordinary Shares ,Hong Kong,Technology,Computer Software: Prepackaged Software
TARA,Protara Therapeutics Inc.  Common Stock,United States,Health Care,Biotechnology: Pharmaceutical Preparations
TARS,Tarsus Pharmaceuticals Inc. Common Stock,United States,Health Care, Medicinal Chemicals and Botanical Products 
TASK,TaskUs Inc. Class A Common Stock,United States,Technology,Retail: Computer Software & Peripheral Equipment
TAST,Carrols Restaurant Group Inc. Common Stock,United States,Consumer Discretionary,Restaurants
TATT,TAT Technologies Ltd. Ordinary Shares,Israel,Industrials,Aerospace
TAYD,Taylor Devices Inc. Common Stock,United States,Industrials,Industrial Machinery/Components
TBBK,The Bancorp Inc Common Stock,United States,Finance,Major Banks
TBCP,Thunder Bridge Capital Partners III Inc. Class A Common Stock,United States,Industrials,Consumer Electronics/Appliances
TBCPU,Thunder Bridge Capital Partners III Inc. Units,United States,Industrials,Consumer Electronics/Appliances
TBCPW,Thunder Bridge Capital Partners III Inc. Warrant,United States,Industrials,Consumer Electronics/Appliances
TBLA,Taboola.com Ltd. Ordinary Shares,Israel,Consumer Discretionary,EDP Services
TBLAW,Taboola.com Ltd. Warrant,Israel,Consumer Discretionary,EDP Services
TBLD,Thornburg Income Builder Opportunities Trust Common Stock,United States,Finance,Investment Managers
TBLT,ToughBuilt Industries Inc. Common Stock,United States,Consumer Discretionary,Diversified Manufacture
TBLTW,ToughBuilt Industries Inc. Warrant,United States,Consumer Discretionary,Diversified Manufacture
TBNK,Territorial Bancorp Inc. Common Stock,United States,Finance,Savings Institutions
TBPH,Theravance Biopharma Inc. Ordinary Shares,Cayman Islands,Health Care,Biotechnology: Pharmaceutical Preparations
TBSA,TB SA Acquisition Corp Class A Ordinary Share,Cayman Islands,Finance,Business Services
TC,TuanChe Limited American Depositary Shares,China,Consumer Discretionary,Business Services
TCBC,TC Bancshares Inc. Common Stock,United States,Finance,Major Banks
TCBI,Texas Capital Bancshares Inc. Common Stock,United States,Finance,Major Banks
TCBIO,Texas Capital Bancshares Inc. Depositary Shares 5.75% Fixed Rate Non-Cumulative Perpetual Preferred Stock Series B,United States,Finance,Major Banks
TCBK,TriCo Bancshares Common Stock,United States,Finance,Major Banks
TCBP,TC BioPharm (Holdings) plc American Depositary Shares,United Kingdom,Health Care,Biotechnology: Biological Products (No Diagnostic Substances)
TCBPW,TC BioPharm (Holdings) plc Warrants,United Kingdom,Health Care,Biotechnology: Biological Products (No Diagnostic Substances)
TCBS,Texas Community Bancshares Inc. Common Stock,United States,Finance,Banks
TCBX,Third Coast Bancshares Inc. Common Stock,United States,Finance,Major Banks
TCDA,Tricida Inc. Common Stock,United States,Health Care,Biotechnology: Pharmaceutical Preparations
TCFC,The Community Financial Corporation Common Stock,United States,Finance,Major Banks
TCMD,Tactile Systems Technology Inc. Common Stock,United States,Health Care,Medical/Dental Instruments
TCOM,Trip.com Group Limited American Depositary Shares,China,Consumer Discretionary,Hotels/Resorts
TCON,TRACON Pharmaceuticals Inc. Common Stock,United States,Health Care,Biotechnology: Biological Products (No Diagnostic Substances)
TCPC,BlackRock TCP Capital Corp. Common Stock,United States,Finance,Finance/Investors Services
TCRR,TCR2 Therapeutics Inc. Common Stock,United States,Health Care,Biotechnology: Pharmaceutical Preparations
TCRT,Alaunos Therapeutics Inc. Common Stock,United States,Health Care,Biotechnology: Pharmaceutical Preparations
TCRX,TScan Therapeutics Inc. Common Stock,United States,Health Care,Biotechnology: Pharmaceutical Preparations
TCVA,TCV Acquisition Corp. Class A Ordinary Shares,United States,Finance,Business Services
TCX,Tucows Inc. Class A Common Stock,Canada,Technology,EDP Services
TDUP,ThredUp Inc. Class A Common Stock,United States,Consumer Discretionary,Department/Specialty Retail Stores
TEAM,Atlassian Corporation Class A Common Stock,United Kingdom,Technology,EDP Services
TECH,Bio-Techne Corp Common Stock,United States,Health Care,Biotechnology: Biological Products (No Diagnostic Substances)
TECTP,Tectonic Financial Inc. 9.00% Fixed-to-Floating Rate Series B Non-Cumulative Perpetual Preferred Stock,United States,Finance,Commercial Banks
TEDU,Tarena International Inc. American Depositary Shares,China,Consumer Discretionary,Service to the Health Industry
TELA,TELA Bio Inc. Common Stock,United States,Health Care,Biotechnology: Electromedical & Electrotherapeutic Apparatus
TENB,Tenable Holdings Inc. Common Stock,United States,Technology,EDP Services
TENK,TenX Keane Acquisition Ordinary Share,United States,,
TENKU,TenX Keane Acquisition Unit,United States,Finance,Business Services
TENX,Tenax Therapeutics Inc. Common Stock,United States,Health Care,Biotechnology: Commercial Physical & Biological Resarch
TER,Teradyne Inc. Common Stock,United States,Industrials,Electrical Products
TERN,Terns Pharmaceuticals Inc. Common Stock,United States,Health Care,Biotechnology: Pharmaceutical Preparations
TESS,TESSCO Technologies Incorporated Common Stock,United States,Telecommunications,Telecommunications Equipment
TETC,Tech and Energy Transition Corporation Class A Common Stock,United States,Industrials,Consumer Electronics/Appliances
TETCW,Tech and Energy Transition Corporation Warrant,United States,Industrials,Consumer Electronics/Appliances
TETE,Technology & Telecommunication Acquisition Corporation Class A Ordinary Shares,Malaysia,Finance,Business Services
TETEU,Technology & Telecommunication Acquisition Corporation Unit,Malaysia,Finance,Business Services
TETEW,Technology & Telecommunication Acquisition Corporation Warrant,Malaysia,Finance,Business Services
TFFP,TFF Pharmaceuticals Inc. Common Stock,United States,Health Care, Medicinal Chemicals and Botanical Products 
TFIN,Triumph Financial Inc. Common Stock,United States,Finance,Major Banks
TFINP,Triumph Financial Inc. Depositary Shares Each Representing a 1/40th Interest in a Share of 7.125% Series C Fixed-Rate Non-Cumulative Perpetual Preferred Stock,United States,,
TFSL,TFS Financial Corporation Common Stock,United States,Finance,Savings Institutions
TGAA,Target Global Acquisition I Corp. Class A Ordinary Share,Cayman Islands,Finance,Business Services
TGAAU,Target Global Acquisition I Corp. Unit,Cayman Islands,Finance,Business Services
TGAAW,Target Global Acquisition I Corp. Warrant,Cayman Islands,Finance,Business Services
TGAN,Transphorm Inc. Common Stock,United States,Technology,Semiconductors
TGL,Treasure Global Inc. Common Stock,United States,Technology,Retail: Computer Software & Peripheral Equipment
TGTX,TG Therapeutics Inc. Common Stock,United States,Health Care,Biotechnology: Pharmaceutical Preparations
TGVC,TG Venture Acquisition Corp. Class A Common Stock,United States,Industrials,Consumer Electronics/Appliances
TGVCU,TG Venture Acquisition Corp. Units,United States,Industrials,Consumer Electronics/Appliances
TGVCW,TG Venture Acquisition Corp. Warrants,United States,Industrials,Consumer Electronics/Appliances
TH,Target Hospitality Corp. Common Stock,United States,Consumer Discretionary,Diversified Commercial Services
THAC,Thrive Acquisition Corporation Class A ordinary shares,United States,Finance,Business Services
THACU,Thrive Acquisition Corporation Unit,United States,Finance,Business Services
THACW,Thrive Acquisition Corporation Warrant,United States,Finance,Business Services
THCH,TH International Limited Ordinary shares,China,,
THCHW,TH International Limited Warrant,China,,
THCP,Thunder Bridge Capital Partners IV Inc. Class A Common Stock,United States,Industrials,Consumer Electronics/Appliances
THCPU,Thunder Bridge Capital Partners IV Inc. Unit,United States,Industrials,Consumer Electronics/Appliances
THFF,First Financial Corporation Indiana Common Stock,United States,Finance,Major Banks
THMO,ThermoGenesis Holdings Inc. Common Stock,United States,Industrials,Medical Specialities
THRD,Third Harmonic Bio Inc. Common Stock,United States,Health Care,Biotechnology: Pharmaceutical Preparations
THRM,Gentherm Inc Common Stock,United States,Consumer Discretionary,Auto Parts:O.E.M.
THRN,Thorne Healthtech Inc. Common Stock,United States,Consumer Staples,Farming/Seeds/Milling
THRX,Theseus Pharmaceuticals Inc. Common Stock,United States,Health Care,Biotechnology: Pharmaceutical Preparations
THRY,Thryv Holdings Inc. Common Stock,United States,Industrials,Industrial Machinery/Components
THTX,Theratechnologies Inc. Common Shares,Canada,Health Care,Pharmaceuticals and Biotechnology
THWWW,Target Hospitality Corp. Warrant expiring 3/15/2024,United States,Consumer Discretionary,Diversified Commercial Services
TIG,Trean Insurance Group Inc. Common Stock,United States,,
TIGO,Millicom International Cellular S.A. Common Stock,Luxembourg,Telecommunications,Telecommunications Equipment
TIGR,UP Fintech Holding Ltd American Depositary Share representing fifteen Class A Ordinary Shares,China,Finance,Investment Bankers/Brokers/Service
TIL,Instil Bio Inc. Common Stock,United States,Health Care,Biotechnology: Pharmaceutical Preparations
TILE,Interface Inc. Common Stock,United States,,
TIOA,Tio Tech A Class A Ordinary Share,Germany,Finance,Business Services
TIOAW,Tio Tech A Warrants,Germany,Finance,Business Services
TIPT,Tiptree Inc. Common Stock,United States,Finance,Accident &Health Insurance
TIRX,TIAN RUIXIANG Holdings Ltd Class A Ordinary Shares,China,Finance,Specialty Insurers
TITN,Titan Machinery Inc. Common Stock,United States,,
