Symbol,Name,Country,Sector,Industry
FHN^E,First Horizon Corporation Depositary Shares each representing a 1/4000th interest in a share of Non-Cumulative Perpetual Preferred Stock Series E,United States,,
FHN^F,First Horizon Corporation Depositary Shares each representing 1/4000th Interest in a Share of Non-Cumulative Perpetual Preferred Stock Series F,United States,,
FICO,Fair Isaac Corproation Common Stock,United States,Technology,Computer Software: Prepackaged Software
FIF,First Trust Energy Infrastructure Fund Common Shares of Beneficial Interest,United States,Finance,Finance/Investors Services
FIGS,FIGS Inc. Class A Common Stock,,Consumer Discretionary,Medical Specialities
FINS,Angel Oak Financial Strategies Income Term Trust Common Shares of Beneficial Interest,,Finance,Finance/Investors Services
FINV,FinVolution Group American Depositary Shares,United States,Finance,Finance: Consumer Services
FIS,Fidelity National Information Services Inc. Common Stock,United States,Consumer Discretionary,Business Services
FIX,Comfort Systems USA Inc. Common Stock,United States,Industrials,Engineering & Construction
FL,Foot Locker Inc.,United States,Consumer Discretionary,Clothing/Shoe/Accessory Stores
FLC,Flaherty & Crumrine Total Return Fund Inc Common Stock,United States,Finance,Trusts Except Educational Religious and Charitable
FLME,Flame Acquisition Corp. Class A Common Stock,,Industrials,Consumer Electronics/Appliances
FLNG,FLEX LNG Ltd. Ordinary Shares,,Consumer Discretionary,Marine Transportation
FLO,Flowers Foods Inc. Common Stock,United States,Consumer Staples,Farming/Seeds/Milling
FLR,Fluor Corporation Common Stock,United States,Industrials,Oilfield Services/Equipment
FLS,Flowserve Corporation Common Stock,United States,Industrials,Fluid Controls
FLT,FleetCor Technologies Inc. Common Stock,United States,Technology,EDP Services
FMC,FMC Corporation Common Stock,United States,Industrials,Agricultural Chemicals
FMN,Federated Hermes Premier Municipal Income Fund,United States,Finance,Finance Companies
FMS,Fresenius Medical Care AG Common Stock,Germany,Health Care,Medical/Nursing Services
FMX,Fomento Economico Mexicano S.A.B. de C.V. Common Stock,Mexico,Consumer Staples,Beverages (Production/Distribution)
FMY,First Trust Motgage Income Fund Common Shares of Beneficial Interest,United States,Finance,Finance/Investors Services
FN,Fabrinet Ordinary Shares,Cayman Islands,Utilities,Telecommunications Equipment
FNA,Paragon 28 Inc. Common Stock,,Health Care,Biotechnology: Electromedical & Electrotherapeutic Apparatus
FNB,F.N.B. Corporation Common Stock,United States,Finance,Major Banks
FNB^E,F.N.B. Corporation Depositary Shares each representing a 1/40th interest in a share of Fixed-to-Floating Rate Non-Cumulative Perpetual Preferred  Stock Series E,United States,,
FND,Floor & Decor Holdings Inc. Common Stock,,Consumer Discretionary,RETAIL: Building Materials
FNF,FNF Group of Fidelity National Financial Inc. Common Stock,United States,Finance,Specialty Insurers
FNV,Franco-Nevada Corporation,Canada,,
FOA,Finance of America Companies Inc. Class A Common Stock,,Finance,Finance Companies
FOF,Cohen & Steers Closed-End Opportunity Fund Inc. Common Stock,United States,Finance,Finance/Investors Services
FOR,Forestar Group Inc Common Stock ,United States,Finance,Real Estate
FORG,ForgeRock Inc. Class A Common Stock,,Technology,Computer Software: Prepackaged Software
FOUR,Shift4 Payments Inc. Class A Common Stock,United States,Technology,EDP Services
FPAC,Far Peak Acquisition Corporation Class A Ordinary Shares,,Finance,Finance: Consumer Services
FPF,First Trust Intermediate Duration Preferred & Income Fund Common Shares of Beneficial Interest,,Finance,Trusts Except Educational Religious and Charitable
FPH,Five Point Holdings LLC Class A Common Shares,United States,Real Estate,Real Estate
FPI,Farmland Partners Inc. Common Stock,,Real Estate,Real Estate Investment Trusts
FPL,First Trust New Opportunities MLP & Energy Fund Common Shares of Beneficial Interest,,Finance,Trusts Except Educational Religious and Charitable
FR,First Industrial Realty Trust Inc. Common Stock,United States,Real Estate,Real Estate Investment Trusts
FRA,Blackrock Floating Rate Income Strategies Fund Inc  Common Stock,United States,Finance,Trusts Except Educational Religious and Charitable
FRC,FIRST REPUBLIC BANK Common Stock,United States,Finance,Commercial Banks
FRC^H,FIRST REPUBLIC BANK Depositary Shares each representing a 1/40th interest in a share of 5.125% Noncumulative Perpetual Series H Preferred Stock par value $0.01 per share,United States,,
FRC^I,FIRST REPUBLIC BANK Depositary Shares each representing a 1/40th interest in a share of 5.50% Noncumulative Perpetual Series I Preferred Stock par value $0.01 per share,United States,,
FRC^J,FIRST REPUBLIC BANK Depositary Shares Each Representing a 1/40th Interest in a Share of 4.70% Noncumulative Perpetual Series J Preferred Stock,United States,,
FRC^K,FIRST REPUBLIC BANK Depositary Shares Each Representing a 1/40th Interest in a Share of 4.125% Noncumulative Perpetual Series K Preferred Stock,United States,,
FRC^L,FIRST REPUBLIC BANK Depositary Shares Each Representing a 1/40th Interest in a Share of 4.250% Noncumulative Perpetual Series L Preferred Stock,United States,,
FRC^M,FIRST REPUBLIC BANK Depositary Shares each representing a 1/40th interest in a share of 4.000% Noncumulative Perpetual Series M Preferred Stock,United States,,
FRC^N,First Republic Bank Depositary Shares Each Representing a 1/40th Interest in a Share of 4.500% Noncumulative Perpetual Series N Preferred Stock,United States,,
FREY,FREYR Battery Ordinary Shares,,Miscellaneous,Industrial Machinery/Components
FRGE,Forge Global Holdings Inc. Common Stock,,Technology,Computer Software: Prepackaged Software
FRO,Frontline Ltd. Ordinary Shares,Bermuda,Consumer Discretionary,Marine Transportation
FRT,Federal Realty Investment Trust Common Stock,United States,Real Estate,Real Estate Investment Trusts
FRT^C,Federal Realty Investment Trust Depositary Shares each representing a 1/1000th interest in a 5.000% Series C Cumulative Redeemable Preferred Share,United States,,
FRXB,Forest Road Acquisition Corp. II Class A Common Stock,,Industrials,Consumer Electronics/Appliances
FSCO,FS Credit Opportunities Corp. Common Stock,,Finance,Trusts Except Educational Religious and Charitable
FSD,First Trust High Income Long Short Fund Common Shares of Beneficial Interest,,Finance,Investment Managers
FSK,FS KKR Capital Corp. Common Stock,,Finance,Investment Managers
FSLY,Fastly Inc. Class A Common Stock,,Technology,Computer Software: Prepackaged Software
FSM,Fortuna Silver Mines Inc Ordinary Shares (Canada),Canada,,
FSNB,Fusion Acquisition Corp. II Class A Common Stock,,Industrials,Consumer Electronics/Appliances
FSR,Fisker Inc. Class A Common Stock,,,
FSS,Federal Signal Corporation Common Stock,United States,Technology,Industrial Machinery/Components
FT,Franklin Universal Trust Common Stock,United States,Finance,Trusts Except Educational Religious and Charitable
FTCH,Farfetch Limited Class A Ordinary Shares,,Consumer Discretionary,Catalog/Specialty Distribution
FTEV,FinTech Evolution Acquisition Group Class A Ordinary Shares,,Finance,Business Services
FTHY,First Trust High Yield Opportunities 2027 Term Fund Common Stock,United States,Finance,Investment Managers
FTI,TechnipFMC plc Ordinary Share,,Industrials,Metal Fabrications
FTK,Flotek Industries Inc. Common Stock,United States,Energy,Oilfield Services/Equipment
FTS,Fortis Inc. Common Shares,,Utilities,Electric Utilities: Central
FTV,Fortive Corporation Common Stock ,,Industrials,Industrial Machinery/Components
FUBO,fuboTV Inc. Common Stock,,Industrials,Broadcasting
FUL,H. B. Fuller Company Common Stock,United States,Industrials,Home Furnishings
FUN,Cedar Fair L.P. Common Stock,United States,Consumer Discretionary,Movies/Entertainment
FVRR,Fiverr International Ltd. Ordinary Shares no par value,,Consumer Discretionary,Business Services
FXLV,F45 Training Holdings Inc. Common Stock,,Consumer Discretionary,Other Consumer Services
FZT,FAST Acquisition Corp. II Class A Common Stock,,Industrials,Consumer Electronics/Appliances
G,Genpact Limited Common Stock,Bermuda,Consumer Discretionary,Professional Services
GAB,Gabelli Equity Trust Inc. (The) Common Stock,United States,Finance,Investment Managers
GAB^G,Gabelli Equity Trust Inc. (The) Series G Cumulative Preferred Stock,United States,,
GAB^H,Gabelli Equity Trust Inc. (The) Pfd Ser H,United States,,
GAB^K,Gabelli Equity Trust Inc. (The) 5.00% Series K Cumulative Preferred Stock,United States,,
GAM,General American Investors Inc. Common Stock,United States,Finance,Investment Managers
GAM^B,General American Investors Company Inc. Cumulative Preferred Stock,United States,,
GAQ,Generation Asia I Acquisition Limited Class A Ordinary Shares,,Finance,Business Services
GATO,Gatos Silver Inc. Common Stock,United States,Basic Materials,Precious Metals
GATX,GATX Corporation Common Stock,United States,Consumer Discretionary,Rental/Leasing Companies
GB,Global Blue Group Holding AG Ordinary Shares,,Technology,EDP Services
GBAB,Guggenheim Taxable Municipal Bond & Investment Grade Debt Trust Common Shares of Beneficial Interest,United States,Finance,Investment Managers
GBCI,Glacier Bancorp Inc. Common Stock,United States,Finance,Major Banks
GBLI,Global Indemnity Group LLC Class A Common Stock (DE),Ireland,Finance,Property-Casualty Insurers
GBTG,Global Business Travel Group Inc. Class A Common Stock,United States,Technology,Computer Software: Prepackaged Software
GBX,Greenbrier Companies Inc. (The) Common Stock,United States,Industrials,Railroads
GCI,Gannett Co. Inc. Common Stock,,Consumer Discretionary,Newspapers/Magazines
GCO,Genesco Inc. Common Stock,United States,,
GCV,Gabelli Convertible and Income Securities Fund Inc. (The) Common Stock,United States,Finance,Finance/Investors Services
GD,General Dynamics Corporation Common Stock,United States,Industrials,Aerospace
GDDY,GoDaddy Inc. Class A Common Stock,United States,Technology,EDP Services
GDL,GDL Fund The Common Shares of Beneficial Interest,United States,Finance,Investment Managers
GDL^C,The GDL Fund Series C Cumulative Puttable and Callable Preferred Shares,United States,,
GDO,Western Asset Global Corporate Defined Opportunity Fund Inc. Western Asset Global Corporate Defined Opportunity Fund Inc.,United States,Finance,Finance Companies
GDOT,Green Dot Corporation Class A Common Stock $0.001 par value,United States,Finance,Advertising
GDV,Gabelli Dividend & Income Trust Common Shares of Beneficial Interest,United States,Finance,Investment Managers
GDV^H,The Gabelli Dividend & Income Trust 5.375% Series H Cumulative Preferred Shares,United States,,
GDV^K,The Gabelli Dividend & Income Trust 4.250% Series K Cumulative Preferred Shares,United States,,
GE,General Electric Company Common Stock,United States,Consumer Discretionary,Metal Fabrications
GEF,Greif Inc. Class A Common Stock,United States,,
GEHI,Gravitas Education Holdings Inc. American depositary shares each representing twenty Class A ordinary shares,,Consumer Discretionary,Other Consumer Services
GEL,Genesis Energy L.P. Common Units,United States,Energy,Oil Refining/Marketing
GENI,Genius Sports Limited Ordinary Shares,,Consumer Discretionary,Services-Misc. Amusement & Recreation
GEO,Geo Group Inc (The) REIT,United States,,
GER,Goldman Sachs MLP Energy Renaissance Fund,,Finance,Trusts Except Educational Religious and Charitable
GES,Guess? Inc. Common Stock,United States,,
GETR,Getaround Inc. Common Stock,,Technology,EDP Services
GETY,Getty Images Holdings Inc. Class A Common Stock,,Industrials,Industrial Machinery/Components
GF,New Germany Fund Inc. (The) Common Stock,United States,Finance,Investment Managers
GFF,Griffon Corporation Common Stock,United States,Industrials,Consumer Electronics/Appliances
GFI,Gold Fields Limited American Depositary Shares,South Africa,Basic Materials,Precious Metals
GFL,GFL Environmental Inc. Subordinate voting shares no par value,,,
GFLU,GFL Environmental Inc. Tangible Equity Units,,,
GFOR,Graf Acquisition Corp. IV Common Stock,,Industrials,Consumer Electronics/Appliances
GFX,Golden Falcon Acquisition Corp. Class A Common Stock,,Industrials,Consumer Electronics/Appliances
GGB,Gerdau S.A. Common Stock,Brazil,Industrials,Steel/Iron Ore
GGG,Graco Inc. Common Stock,United States,Industrials,Fluid Controls
GGT,Gabelli Multi-Media Trust Inc. (The) Common Stock,United States,Finance,Trusts Except Educational Religious and Charitable
GGT^E,Gabelli Multi-Media Trust Inc. (The) 5.125% Series E Cumulative Preferred Stock,United States,,
GGT^G,Gabelli Multi-Media Trust Inc. (The) 5.125% Series G Cumulative Preferred Shares,United States,,
GGZ,Gabelli Global Small and Mid Cap Value Trust (The) Common Shares of Beneficial Interest,,Finance,Investment Managers
GHC,Graham Holdings Company Common Stock,United States,Consumer Discretionary,Service to the Health Industry
GHG,GreenTree Hospitality Group Ltd. American depositary shares each representing one Class A ordinary share,,Consumer Discretionary,Hotels/Resorts
GHI,Greystone Housing Impact Investors LP Beneficial Unit Certificates representing assignments of limited partnership interests,United States,Finance,Finance: Consumer Services
GHL,Greenhill & Co. Inc. Common Stock,United States,Finance,Investment Bankers/Brokers/Service
GHLD,Guild Holdings Company Class A Common Stock,,Finance,Finance: Consumer Services
GHM,Graham Corporation Common Stock,United States,Industrials,Metal Fabrications
GHY,PGIM Global High Yield Fund Inc.,United States,Finance,Trusts Except Educational Religious and Charitable
GIA,GigCapital 5 Inc. Common Stock,,Industrials,Consumer Electronics/Appliances
GIB,CGI Inc. Common Stock,Canada,,
GIC,Global Industrial Company Common Stock,United States,Technology,Industrial Machinery/Components
GIL,Gildan Activewear Inc. Class A Sub. Vot. Common Stock,Canada,Consumer Discretionary,Building Products
GIM,Templeton Global Income Fund Inc. Common Stock,United States,Finance,Finance Companies
GIS,General Mills Inc. Common Stock,United States,Consumer Staples,Food Chains
GJH,Synthetic Fixed-Income Securities Inc 6.375% (STRATS) Cl A-1,United States,,
GJO,Synthetic Fixed-Income Securities Inc. Synthetic Fixed-Income Securities Inc. on behalf of STRATS(SM) Trust for Wal-Mart Stores Inc. Securities Series 2004-5,United States,,
GJP,Synthetic Fixed-Income Securities Inc. Synthetic Fixed-Income Securities Inc. on behalf of STRATS (SM) Trust for Dominion Resources Inc. Securities Series 2005-6 Floating Rate Structured Repackaged Asset-Backed Trust Securities (STRATS) Certificates,United States,,
GJR,Synthetic Fixed-Income Securities Inc. STRATS Trust for Procter&Gamble Securities Series 2006-1,United States,Finance,Finance: Consumer Services
GJS,Goldman Sachs Group Securities STRATS Trust for Goldman Sachs Group Securities Series 2006-2,United States,Finance,Finance: Consumer Services
GJT,Synthetic Fixed-Income Securities Inc. Synthetic Fixed-Income Securities Inc. Floating Rate Structured Repackaged Asset-Backed Trust Securities Certificates Series 2006-3,United States,,
GKOS,Glaukos Corporation Common Stock,United States,Health Care,Biotechnology: Electromedical & Electrotherapeutic Apparatus
GL,Globe Life Inc. Common Stock,United States,Finance,Life Insurance
GL^D,Globe Life Inc. 4.25% Junior Subordinated Debentures due 2061,United States,,
GLOB,Globant S.A. Common Shares,,Technology,EDP Services
GLOG^A,GasLog LP. 8.75% Series A Cumulative Redeemable Perpetual Preference Shares,Monaco,,
GLOP,GasLog Partners LP Common Units representing limited partnership interests,,Energy,Oil & Gas Production
GLOP^A,GasLog Partners LP 8.625% Series A Cumulative Redeemable Perpetual Fixed to Floating Rate Preference Units,,,
GLOP^B,GasLog Partners LP 8.200% Series B Cumulative Redeemable Perpetual Fixed to Floating Rate Preference Units,,,
GLOP^C,GasLog Partners LP 8.500% Series C Cumulative Redeemable Perpetual Fixed to Floating Rate Preference Units,,,
GLP,Global Partners LP Global Partners LP Common Units representing Limited Partner Interests,United States,Energy,Oil Refining/Marketing
GLP^A,Global Partners LP 9.75% Series A Fixed-to-Floating Rate Cumulative Redeemable Perpetual Preferred Units representing limited partner interests,United States,,
GLP^B,Global Partners LP 9.50% Series B Fixed Rate Cumulative Redeemable Perpetual Preferred Units representing limited partner interests,United States,,
GLS,Gelesis Holdings Inc. Common Stock,,Health Care,Biotechnology: Biological Products (No Diagnostic Substances)
GLT,Glatfelter Corporation Common Stock,United States,Basic Materials,Paper
GLW,Corning Incorporated Common Stock,United States,Technology,Industrial Machinery/Components
GM,General Motors Company Common Stock,United States,Consumer Discretionary,Auto Manufacturing
GME,GameStop Corporation Common Stock,United States,Consumer Discretionary,Electronics Distribution
GMED,Globus Medical Inc. Class A Common Stock,United States,Health Care,Medical/Dental Instruments
GMRE,Global Medical REIT Inc. Common Stock,,Real Estate,Real Estate Investment Trusts
GMRE^A,Global Medical REIT Inc. Series A Cumulative Redeemable Preferred Stock,,,
GMS,GMS Inc. Common Stock,United States,,
GNE,Genie Energy Ltd. Class B Common Stock Stock,United States,Utilities,Power Generation
GNE^A,Genie Energy Ltd. Series 2012 - A Preferred Stock $0.01 par value,United States,,
GNK,Genco Shipping & Trading Limited Ordinary Shares New (Marshall Islands),United States,Consumer Discretionary,Marine Transportation
GNL,Global Net Lease Inc. Common Stock,United States,Real Estate,Real Estate Investment Trusts
GNL^A,Global Net Lease Inc. 7.25% Series A Cumulative Redeemable Preferred Stock $0.01 par value per share,United States,,
GNL^B,Global Net Lease Inc. 6.875% Series B Cumulative Redeemable Perpetual Preferred Stock,United States,,
GNRC,Generac Holdlings Inc. Common Stock,United States,Consumer Discretionary,Metal Fabrications
GNT,GAMCO Natural Resources Gold & Income Trust,United States,Finance,Finance/Investors Services
GNT^A,GAMCO Natural Resources Gold & Income Tust  5.20% Series A Cumulative Preferred Shares (Liquidation Preference $25.00 per share),United States,,
GNW,Genworth Financial Inc Common Stock,United States,Finance,Life Insurance
GOF,Guggenheim Strategic Opportunities Fund Common Shares of Beneficial Interest,United States,Finance,Finance/Investors Services
GOGN,GoGreen Investments Corporation Class A Ordinary Shares,,Finance,Business Services
GOL,Gol Linhas Aereas Inteligentes S.A. Sponsored ADR representing 2 Pfd Shares,Brazil,Consumer Discretionary,Air Freight/Delivery Services
GOLD,Barrick Gold Corporation Common Stock (BC),Canada,,
GOLF,Acushnet Holdings Corp. Common Stock,United States,Consumer Discretionary,Recreational Games/Products/Toys
GOOS,Canada Goose Holdings Inc. Subordinate Voting Shares,,,
GOTU,Gaotu Techedu Inc. American Depositary Shares,,Real Estate,Other Consumer Services
GPC,Genuine Parts Company Common Stock,United States,Consumer Discretionary,Automotive Aftermarket
GPI,Group 1 Automotive Inc. Common Stock,United States,Consumer Discretionary,Other Specialty Stores
GPJA,Georgia Power Company Series 2017A 5.00% Junior Subordinated Notes due October 1 2077,United States,,
GPK,Graphic Packaging Holding Company,United States,Basic Materials,Paper
GPMT,Granite Point Mortgage Trust Inc. Common Stock,,Real Estate,Real Estate Investment Trusts
GPMT^A,Granite Point Mortgage Trust Inc. 7.00% Series A Fixed-to-Floating Rate Cumulative Redeemable Preferred Stock,,,
GPN,Global Payments Inc. Common Stock,United States,Consumer Discretionary,Business Services
GPOR,Gulfport Energy Corporation Common Shares,United States,Energy,Oil & Gas Production
GPRK,Geopark Ltd Common Shares,Bermuda,Energy,Oil & Gas Production
GPS,Gap Inc. (The) Common Stock,United States,Consumer Discretionary,Clothing/Shoe/Accessory Stores
GRBK,Green Brick Partners Inc. Common Stock,United States,Consumer Discretionary,Homebuilding
GRBK^A,Green Brick Partners Inc. Depositary Shares (each representing a 1/1000th fractional interest in a share of 5.75% Series A Cumulative Perpetual Preferred Stock),United States,,
GRC,Gorman-Rupp Company (The) Common Stock,United States,Industrials,Fluid Controls
GRMN,Garmin Ltd. Common Stock (Switzerland),Switzerland,Industrials,Industrial Machinery/Components
GRND,Grindr Inc. Common Stock,Singapore,Technology,Computer Software: Prepackaged Software
GRNT,Granite Ridge Resources Inc. Common Stock,,Industrials,Consumer Electronics/Appliances
GROV,Grove Collaborative Holdings Inc. Class A Common Stock,,Consumer Discretionary,Package Goods/Cosmetics
GRX,The Gabelli Healthcare & Wellness Trust Common Shares of Beneficial Interest,United States,Finance,Finance/Investors Services
GS,Goldman Sachs Group Inc. (The) Common Stock,United States,Finance,Investment Bankers/Brokers/Service
GS^A,Goldman Sachs Group Inc. (The) Depositary Shares each representing 1/1000th Interest in a Share of Floating Rate Non-Cumulative Preferred Stock Series A,United States,,
GS^C,Goldman Sachs Group Inc. (The) Depositary Share repstg 1/1000th Preferred Series C,United States,,
GS^D,Goldman Sachs Group Inc. (The) Dep Shs repstg 1/1000 Pfd Ser D Fltg,United States,,
GS^J,Goldman Sachs Group Inc Depositary Shs Repstg 1/1000th Pfd Ser J Fixed to Fltg Rate,United States,,
GS^K,Goldman Sachs Group Inc. (The) Dep Shs Repstg 1/1000 Int Sh Fxd/Fltg Non Cum Pfd Stk Ser K,United States,,
GSBD,Goldman Sachs BDC Inc. Common Stock,United States,Finance,Investment Managers
GSK,GSK plc American Depositary Shares (Each representing two Ordinary Shares),United Kingdom,Health Care,Biotechnology: Pharmaceutical Preparations
GSL,Global Ship Lease Inc New Class A Common Shares,United Kingdom,Consumer Discretionary,Marine Transportation
GSL^B,Global Ship Lease Inc. Depository Shares Representing 1/100th Perpetual Preferred Series B% (Marshall Island),United Kingdom,,
GSQB,G Squared Ascend II Inc. Class A Ordinary Shares,,Finance,Business Services
GSQD,G Squared Ascend I Inc. Class A Ordinary Shares,,Finance,Business Services
GTES,Gates Industrial Corporation plc Ordinary Shares,,Industrials,Industrial Machinery/Components
GTLS,Chart Industries Inc. Common Stock,United States,Technology,Electrical Products
GTLS^B,Chart Industries Inc. Depositary Shares each Representing a 1/20th Interest in a Share of 6.75% Series B Mandatory Convertible Preferred Stock,United States,,
GTN,Gray Television Inc. Common Stock,United States,Industrials,Broadcasting
GTY,Getty Realty Corporation Common Stock,United States,Real Estate,Real Estate Investment Trusts
GUG,Guggenheim Active Allocation Fund Common Shares of Beneficial Interest,,Finance,Trusts Except Educational Religious and Charitable
GUT,Gabelli Utility Trust (The) Common Stock,United States,Finance,Trusts Except Educational Religious and Charitable
GUT^C,Gabelli Utility Trust (The) 5.375% Series C Cumulative Preferred Shares,United States,,
GVA,Granite Construction Incorporated Common Stock,United States,Industrials,Engineering & Construction
GWH,ESS Tech Inc. Common Stock,United States,Industrials,Industrial Machinery/Components
GWRE,Guidewire Software Inc. Common Stock,United States,Technology,Computer Software: Prepackaged Software
GWW,W.W. Grainger Inc. Common Stock,United States,Consumer Discretionary,Telecommunications Equipment
GXO,GXO Logistics Inc. Common Stock ,,,
H,Hyatt Hotels Corporation Class A Common Stock,United States,Consumer Discretionary,Hotels/Resorts
HAE,Haemonetics Corporation Common Stock,United States,Health Care,Medical/Dental Instruments
HAL,Halliburton Company Common Stock,United States,Energy,Oil & Gas Production
HASI,Hannon Armstrong Sustainable Infrastructure Capital Inc. Common Stock,United States,Real Estate,Real Estate Investment Trusts
HAYW,Hayward Holdings Inc. Common Stock,,Technology,Electronic Components
HBB,Hamilton Beach Brands Holding Company Class A Common Stock ,,,
HBI,Hanesbrands Inc. Common Stock,United States,Consumer Discretionary,Apparel
HBM,Hudbay Minerals Inc. Ordinary Shares (Canada),Canada,,
HCA,HCA Healthcare Inc. Common Stock,United States,Health Care,Hospital/Nursing Management
HCC,Warrior Met Coal Inc. Common Stock,United States,,
HCI,HCI Group Inc. Common Stock,United States,Finance,Property-Casualty Insurers
HCXY,Hercules Capital Inc. 6.25% Notes due 2033,United States,Finance,Investment Managers
HD,Home Depot Inc. (The) Common Stock,United States,Consumer Discretionary,RETAIL: Building Materials
HDB,HDFC Bank Limited Common Stock,India,Finance,Commercial Banks
HE,Hawaiian Electric Industries Inc. Common Stock,United States,Utilities,Power Generation
HEI,Heico Corporation Common Stock,United States,Industrials,Military/Government/Technical
HEI/A,Heico Corporation,United States,,
HEP,Holly Energy Partners L.P. Common Stock,United States,,
HEQ,John Hancock Hedged Equity & Income Fund Common Shares of Beneficial Interest,United States,Finance,Investment Managers
HES,Hess Corporation Common Stock,United States,Energy,Oil & Gas Production
HESM,Hess Midstream LP Class A Share,United States,Energy,Oilfield Services/Equipment
HFRO,Highland Income Fund,,Finance,Finance/Investors Services
HFRO^A,Highland Income Fund 5.375% Series A Cumulative Preferred Shares,,,
HGLB,Highland Global Allocation Fund Common Stock,,Finance,Trusts Except Educational Religious and Charitable
HGTY,Hagerty Inc. Class A Common Stock,,Finance,Specialty Insurers
HGV,Hilton Grand Vacations Inc. Common Stock ,,Consumer Discretionary,Hotels/Resorts
HHC,Howard Hughes Corporation (The) Common Stock,United States,Real Estate,Building operators
HHLA,HH&L Acquisition Co. Class A Ordinary Shares,,Finance,Business Services
HI,Hillenbrand Inc Common Stock,United States,Consumer Discretionary,Consumer Specialties
